{
  "$schema": "https://json-schema.org/draft/2020-12/schema",
  "$id": "https://github.com/codingwithchad/whatsupahead/schema/place.schema.json",
  "title": "Featured place",
  "description": "A place shown as a one-tap button on the home page. Cameras are never attached to a place; results come from distance.",
  "type": "object",
  "additionalProperties": false,
  "required": [
    "id",
    "name",
    "lat",
    "lon"
  ],
  "properties": {
    "id": {
      "type": "string",
      "pattern": "^[a-z0-9]+(-[a-z0-9]+)*$"
    },
    "name": {
      "type": "string",
      "minLength": 1
    },
    "region": {
      "type": "string"
    },
    "blurb": {
      "type": "string"
    },
    "lat": {
      "type": "number",
      "minimum": -90,
      "maximum": 90
    },
    "lon": {
      "type": "number",
      "minimum": -180,
      "maximum": 180
    },
    "radius_miles": {
      "type": "number",
      "minimum": 1,
      "maximum": 75,
      "description": "Default search radius for this place."
    },
    "order": {
      "type": "number",
      "description": "Lower numbers first. Popular places can go first later."
    },
    "collection": {
      "type": "string",
      "description": "Id of a collection (data/collections) this place belongs to. Places in a collection are listed there instead of on the main home list."
    },
    "include_kinds": {
      "type": "array",
      "items": {
        "enum": [
          "ferry",
          "airport",
          "border"
        ]
      },
      "uniqueItems": true,
      "description": "Ferry, airport or border reports to show for this place even though it is not in that collection (for example the Mukilteo ferry town)."
    },
    "note": {
      "type": "string",
      "description": "A short note shown above the results, e.g. why there are no cameras yet."
    },
    "also_states": {
      "type": "array",
      "items": { "type": "string" },
      "description": "Other states a place belongs to as well (a ski area on a state line), listed under each."
    },
    "snow_report_url": {
      "type": "string",
      "format": "uri",
      "pattern": "^https://",
      "description": "Ski areas: the resort's own snow report (or mountain report) page, linked from the place page."
    },
    "link": {
      "type": "object",
      "additionalProperties": false,
      "required": [
        "label",
        "url"
      ],
      "properties": {
        "label": {
          "type": "string"
        },
        "url": {
          "type": "string",
          "format": "uri"
        }
      },
      "description": "A small link out, e.g. to the resort's own camera page."
    },
    "camera_tags": {
      "type": "array",
      "items": {
        "type": "string"
      },
      "uniqueItems": true,
      "description": "If set, this place lists only cameras that carry one of these tags (for a themed place such as scenic views) instead of every camera within its radius."
    },
    "weather_radius_miles": {
      "type": "number",
      "minimum": 1,
      "maximum": 75,
      "description": "How far to look for weather reports, when that should be smaller than radius_miles (used by wide themed places)."
    },
    "state": {
      "type": "string",
      "description": "The state this place is in, used to group the places directory. Defaults to Washington."
    }
  }
}
